{"schema":"https://verifyum.com/schema/proof-v2.json","protocol":"verifyum","version":2,"proof_id":"1ns0c79n4m0sy5es4wztcvrm1y","commitment":"sha256:2fbfdec5f845ba34132b79dae39b5956f43c6cb9c40927cbdf3fe59ff124d7eb","submitted_at":"2026-08-30T16:01:01Z","anchor":{"provider":"solana","network":"mainnet-beta","transaction_signature":"5RMLnFdTyz2tHnArZn2ud4hHANc3YW9bAGf6VgQEsq7pPWEhXzqDNr8UzEqNWSixVVWQdU4mA41B2dDo8a7FkmbE","slot":442919487,"block_time":"2026-08-30T16:01:01Z","anchor_address":"FbiVoNKDvhp3XeGiVVa23Fy75EJFZkBRHFhirrX5EiAW","memo":"verifyum:v2:id=1ns0c79n4m0sy5es4wztcvrm1y;alg=sha256;commitment=2fbfdec5f845ba34132b79dae39b5956f43c6cb9c40927cbdf3fe59ff124d7eb","status":"finalized"},"service_signature":{"algorithm":"ed25519","key_id":"verifyum-mainnet-2026-01","value":"8ZNsWI3xwH3atN2TgNFg4m7LQoaxEHvTGiXmp87R3ds28AEMt3ZZ9dHMfehhDJtg44rIgIVuFikmiMCNEF5qAg"}}